{
  "title": "桌面基线插件清单（跨文件单一真相源）",
  "description": "2026-09-14。本文件是「桌面包固定安装哪些上游社区插件、各自钉哪个版本」的数值唯一来源。此前同一份名单存在于两处并靠注释要求手工保持一致：data-plane/dsh-node/src/plugins.ts 的 BASE_PROFILE_PLUGINS 与 PACKAGED_PROFILE_MODULES、desktop/build-runtime.mjs 的 upstreamPluginSpecs。消费方式按「能不能在运行期读仓库文件」分两档：build-runtime.mjs 在构建期、在仓库内运行，直接读本文件（零复制，结构上不可能漂移）；dsh-node 用 tsx 直跑源码、打包后目录布局与仓库不同，运行期读不到本文件，故由 tools/gen-plugin-baseline.mjs 生成 src/generated/plugin-baseline.ts 并提交，由 shared/manifests/__tests__/plugin-baseline.spec.ts 的漂移锁保证与原件一致。改清单 = 改本文件 + 跑 pnpm run codegen:plugin-baseline + 锁绿。语义注释（为什么钉这些版本、为什么排除某几个）写在本文件里，不在消费方重复。",
  "policy": "每个 pin 必须与当前 dsh master 的公共 API 兼容。dsh-settings 在 0.1.2 移除了 installSettingsSection 与 settingsNamespace（由 SettingsProvider 取代），凡在运行期 import 这两个符号的插件都会让 Loader 拒绝整树启动，因此基线版本随 master 一起上移。升版前先在 master 上验证 import 校验通过，再改本文件。第二类同样致命：typert strict codec 的宿主形状（e459e32637 起必须带 `create()` 工厂，见 dsh-typert-loader 的 requireStrictCodec）。它发生在**启动期注册阶段**而非 import 阶段，症状会伪装成别的问题——某端点「定义已撤回」、其余插件「未激活」——不要从症状倒推；识别方式是把每个插件的 `./typert` 产物按 loader 的规则离线校验一遍。第三类只出现在**浏览器半边**：带 `dsh.client` 的插件即使宿主侧一切正常，其 lib/client.js 仍可能在 web 启动期激活失败（症状是 boot 页停在「web boot: N entries did not activate」，服务端反而没有 warning），成因同样是宿主版本代差。这类失效构建期无门禁可查——只有真的在浏览器里装配才会撞上——因此客户端启动按 LUMO_BEST_EFFORT_BOOT（见 dsh-overrides/apply.mjs）尽力而为：单个条目导入失败、激活失败或缺少服务时，按 Loader 最终状态跳过并告警；引导和界面渲染服务缺失仍报告启动错误，不再让一个社区插件把整块工作台拖停摆；发现某个 pin 长期如此就从 baseline 移到 excluded。",
  "baseline": [
    {
      "name": "dshmarket",
      "version": "1.66.6",
      "note": "插件市场：浏览、搜索、安装和更新 DSH 社区插件。客户端依赖 locale、settings 和 theme。"
    },
    {
      "name": "@liustack/modlens",
      "version": "3.26.5",
      "note": "视觉理解：图片读取、OCR 与视觉证据；要求 Node >=22.19。"
    },
    {
      "name": "dsh-context",
      "version": "0.60.0",
      "note": "上下文洞察：上下文组成、趋势、注入、压缩与每一步消息。"
    },
    {
      "name": "dsh-cost-meter",
      "version": "1.7.45",
      "note": "费用统计：会话、当日与历史费用，含预算、模型价格与用量；支持 DSH 0.2 的凭证与 home-paths API。"
    },
    {
      "name": "dsh-dream-skin",
      "version": "9.29.0",
      "note": "桌面换肤：主题、壁纸与每用户强调色，使用原生 theme、locale、slots 服务。"
    }
  ],
  "excluded": [
    {
      "name": "@anweat/dsh-browser",
      "reason": "0.1.10（2026-08-29，最新版）仍 import dsh-settings 已被移除的 installSettingsSection 与 settingsNamespace，master 下无法通过 import 校验，且上游无更新版。已从桌面包基线移除；市场里装到其它 profile 的行为不受影响（那里的 dsh-settings 可能仍是旧 API）。"
    },
    {
      "name": "@nanmicoder/dsh-agent-teams",
      "reason": "0.1.15 调用了 master 已移除的 ctx.subagents.registerContinuableSetup，Loader 会直接拒绝整树启动。仍可通过 SkillHub 手动安装；dsh-node 的插件隔离会在失败时自动 quarantine 并重试。"
    },
    {
      "name": "dsh-univer-office",
      "reason": "0.2.14 曾因只支持 DSH 0.1 的 peerDependencies 在浏览器半边激活失败，导致工作台无法启动，因此移出桌面基线。2026-09-30 查询到的新版本 0.3.5 仍未声明兼容当前 DSH 0.2.0-rc.2，暂不升级外置办公插件，也未授予版本风险豁免。客户端启动现按 Loader 最终状态跳过单个失败或 pending 条目，记录原因并继续挂载可用界面。"
    },
    {
      "name": "@linxin666/dsh-client-ui-task-board",
      "reason": "0.3.14（原 pin）与 0.3.20 的客户端硬依赖 settingsScope，曾在 Web 装配中一直 pending（waiting for service: settingsScope），因此移出桌面基线。2026-09-30 外置版已更新到 0.4.4，客户端代码已移除该直接依赖；本次没有进行浏览器功能测试，暂未重新纳入基线。客户端启动现按 Loader 最终状态跳过单个未激活插件，保留诊断和重试身份。"
    }
  ],
  "packagedFirstParty": [
    "@deepseek-ai/dsh-storage-sqlite",
    "@lumo/agent-teams",
    "@lumo/dsh-platform-ui",
    "@lumo/knowledge-vault",
    "@lumo/open-design",
    "@lumo/archify",
    "@lumo/creative-skills",
    "@lumo/ruflo-orchestration",
    "@lumo/web-fetch-fakeip"
  ],
  "packagedFirstPartyNote": "打包 runtime 下 dsh-node 把 PACKAGED_PROFILE_MODULES 逐个 symlink 到 DSH_HOME/profiles/node_modules，让 patch 里的裸包名能从 profile 目录按 Node 的父级上溯解析到。该名单 = 本数组加 baseline 的包名，由生成器拼装；漏一个时 Loader 报 Cannot find package，整棵插件树挂载失败。"
}
